{
  "contractVersion": "1.0",
  "libraryId": "orbat.standard-symbol-library",
  "libraryRevision": 1,
  "definitionId": "land-unit.main.infantry",
  "definitionRevision": 1,
  "name": "Infantry",
  "domain": "land-unit",
  "role": "main-function",
  "composition": "composable",
  "classification": {
    "category": "Movement and Maneuver",
    "function": "Infantry",
    "variant": "Generic",
    "operatingState": "Ground"
  },
  "layout": {
    "mainScaleWithoutModifiers": 0.88,
    "mainScaleWithOneModifier": 0.74,
    "mainScaleWithTwoModifiers": 0.66,
    "modifierWidthScale": 0.48,
    "modifierHeightScale": 0.18,
    "modifierCenterOffset": 0.34,
    "mainSingleModifierOffset": 0.08,
    "mainOffsetX": 0,
    "mainOffsetY": 0
  },
  "scene": {
    "coordinateSpace": "normalized-cartesian",
    "viewBox": {
      "x": 0,
      "y": 0,
      "width": 1,
      "height": 1
    },
    "primitives": [
      {
        "id": "cross-down",
        "type": "line",
        "start": {
          "x": 0.12,
          "y": 0.12
        },
        "end": {
          "x": 0.88,
          "y": 0.88
        },
        "style": {
          "stroke": "#000000",
          "strokeWidth": 0.025,
          "lineCap": "square"
        }
      },
      {
        "id": "cross-up",
        "type": "line",
        "start": {
          "x": 0.88,
          "y": 0.12
        },
        "end": {
          "x": 0.12,
          "y": 0.88
        },
        "style": {
          "stroke": "#000000",
          "strokeWidth": 0.025,
          "lineCap": "square"
        }
      }
    ]
  },
  "extensions": {
    "legacyLibrary": {
      "domain": "LandUnit",
      "symbolRole": "MainFunction"
    }
  },
  "placeable": true
}
